text,index_label,classes,trinary_classes,trinary_class_index
"Today, my friends are assisting me in understanding a pretty difficult topic. I am therefore really appreciative of their tolerance. I really feel like I owe them a lot. I really appreciate them, and now I must act to return the favor. This appreciation is wonderful, and it improves my life.My pals are helping me grasp a really complex subject today. Therefore, I truly appreciate their patience. I have a strong sense that I owe them a lot. I genuinely appreciate them, and now I have to do something to pay them back. My life is better because of this amazing admiration.",9,gratitude,Positive emotions,1
"Today my friends are assisting me in understanding a really difficult topic. Their warmth and tolerance astounded me. I thought he owed them a lot for their assistance. He wanted to let them know how much I valued their relationship since, as I soon understood, he had taken it for granted. To show his friends how much I cared, I made the decision to do something special for them. They were all invited to a surprise party I threw for them. The kindness and feeling of appreciation were sensed by my pals. I realized then and there that friendships may be significantly strengthened by showing thanks and appreciation.",9,gratitude,Positive emotions,1
"Today, my buddies are helping me to comprehend an extremely challenging subject. I was surprised by their friendliness and tolerance. I believed he owed them a great deal for their help. As I quickly realized, he had taken their friendship for granted, therefore he wanted to express how much I cherished it. I decided to do something special for his buddies to show them how much I cared. I gave them a surprise party, and they were all invited. My friends could feel the consideration and care. I understood right then and then that expressing gratitude and appreciation may greatly enhance friendships.",9,gratitude,Positive emotions,1
"I begin to grow throughout puberty, both physically and mentally. I am now overwhelmed by thanks for my parents' efforts and their devotion in providing for me in every manner. I owe them a great debt of gratitude for giving me this life.",9,gratitude,Positive emotions,1
"During my puberty, I start grow in both physica body and mind. I understand the attempt of my parents, their love, they always try to care for me everything, Now I am filled with big gratitude, I owe this life to  them with huge respect and appreciation grategully",9,gratitude,Positive emotions,1
"During puberty, I start to develop both physically and intellectually. I am now overcome with gratitude for my parents' efforts and commitment to taking care of me in every way. They gave me this life, and I owe them a big debt of gratitude.",9,gratitude,Positive emotions,1
"I start to grow both physically and cognitively during puberty. Now when I think of my parents' work and dedication to providing for me in every manner, I am struck with appreciation. I owe them a huge debt of gratitude since they gave me this life.",9,gratitude,Positive emotions,1
"During puberty, I begin to develop mentally and physically. I am now moved to gratitude when I consider how hard my parents worked and how committed they were to provide for me in every way. Since they gave me this life, I owe them a great debt of gratitude.",9,gratitude,Positive emotions,1
"One day, a friend of mine came over to visit me. She brought me some flowers and a card that said “I’m here for you”. I was touched by her kindness and it made me feel better. From that day on, I started to appreciate the little things in life more. I realized that there were people who cared about me and that I wasn’t alone. I started to feel more grateful for the good things in my life and less focused on the negative. My friend’s gesture of kindness helped me see the world in a different light.",9,gratitude,Positive emotions,1
"One day, I had a visit from a buddy. She came over with some flowers and a I'm here for you card. Her thoughtfulness moved me, and it improved my mood. I began to value the simple things in life more after that day. I understood that I was not alone and that there were people out there that cared about me. I began to be more appreciative of the positive aspects of my life and less concerned with the drawbacks. I was able to change how I perceived the world because to my friends thoughtful action.",9,gratitude,Positive emotions,1
"I had a visit from a friend one day. She arrived bearing flowers and a I'm here for you card. I was impressed by her thoughtfulness, and it made me feel better. After that day, I started to appreciate the small things in life more. I realized there were people out there who cared about me and that I wasn't alone. I started to focus less on the negative parts of my life and more on the positive ones. I was able to alter my perspective of the world as a result of my friend's kind deed.",9,gratitude,Positive emotions,1
"One day a buddy came to see me. She showed up with bouquets and a I'm here for you card. Her thoughtfulness pleased me, and it made me feel better. I began to value the little things in life more after that day. I came to the realization that I wasn't alone and that there were others who cared about me. I began to place more emphasis on the positive aspects of my life and less on the unpleasant ones. I was able to change my worldview as a consequence of my friend's thoughtful act.",9,gratitude,Positive emotions,1
"I had been working on a project for months and it was finally coming to an end. I had put in a lot of hard work and dedication into it. When I finally finished it, I felt a sense of pride in myself. I realized that I was capable of achieving great things if I put my mind to it. I am very proud of myself, prides in myself.From that day on, I learned to believe in myself and my abilities more.",10,pride,Positive emotions,1
"I was nearing completion of a project that I had been working on for some months. I had worked really arduously and with great attention on it. I felt proud of myself when I eventually finished it. I came to the conclusion that if I set my mind to anything, I could do amazing things. I take great pleasure in and in myself.I started to have more confidence in my skills and abilities after that day",10,pride,Positive emotions,1
"A project I had been working on for a few months was almost finished. I had put in a lot of effort and paid close attention to it. When I finally finished it, I was pleased with myself. I realized that everything was possible for me to do if I put my mind to it. I enjoy being happy with myself.After that day, I gradually gained greater faith in my skills and abilities.",10,pride,Positive emotions,1
"I believe I am a math prodigy. I am quite pleased of my aptitude in arithmetic. Everyone is pulling for me and giving me accolades. They cheer and compliment me often. They've congratulated me, and I'm really happy.",10,pride,Positive emotions,1
"I think I'm a math genius. I am satisfied with my ability for mathematics. Everyone is rooting for me and praising me. They frequently applaud and commend me. I've received their congratulations, and I'm overjoyed.",10,pride,Positive emotions,1
"I believe I am a math prodigy. I am happy with my mathematical skills. Everyone is cheering me on and complimenting me. They often congratulate and praise me. They have congratulated me, and I am ecstatic.",10,pride,Positive emotions,1
"I think I'm a math genius. My aptitude in mathematics makes me joyful. Everyone is encouraging me and praising me. They frequently congrats and laud me. I've received their congratulations, and I'm overjoyed.",10,pride,Positive emotions,1
"I was nearing completion of a project that I had been working on for a few months. I had worked hard and had paid great attention to it. I was happy with myself after I had done it. I came to the conclusion that everything I set my mind to might be accomplished by me. I like feeling good about myself.After that day, my confidence in my skills and abilities grew over time.",10,pride,Positive emotions,1
"I have always been grateful for my family and the people around me. They have always been there for me through thick and thin. I have learned to appreciate the little things in life because of them. They have taught me that love is the most important thing in life and that it’s important to cherish the people around you. From that day on, I learned to love my family and everyone around me more.",9,gratitude,Positive emotions,1
"I love my parents so much, I always care for them, sending my big heart to my family members all the time.  I want to make my warmth pervasive to everyone around. That is my devotion, relentless love",7,love,Positive emotions,1
I have a huge heart and constantly send it to my family since I adore my parents and take such good care of them.  I want to spread my warmth over the entire area. That is my unwavering love and dedication.,7,love,Positive emotions,1
I have a big heart and continually send it to my family since I love and care for my parents so much.  I want to fill the space with my warmth. That is my undying devotion and adoration.,7,love,Positive emotions,1
"I have always been a very caring person. I love my family and friends and I always try to show them how much I care. I believe that love is the most important thing in life and that it’s important to cherish the people around you. From that day on, I learned to love my family and everyone around me more.",7,love,Positive emotions,1
"I've always taken great care of others. I constantly strive to show my friends and family how much I care because I adore them. Love, in my opinion, is the most significant aspect of life, and I think it's crucial to value the people in your life. I gained a greater affection for my family and everyone around me after that day.",7,love,Positive emotions,1
"I've always given them my very best. I love my friends and family and I always try to make sure they know how much I care for them. Love is the most important component of life, in my opinion, and it's important to cherish the people in your life, in my opinion. After that day, I had a deeper love for my family and everyone else in my life.",7,love,Positive emotions,1
"I have always had a soft spot for underprivileged children. I believe that every child deserves a chance to succeed in life. From that day on, I learned to love and care for underprivileged children more.  I have a big heart and continually send it to them since I love and care for them so much.",7,love,Positive emotions,1
"I've always had a special place for kids from poor backgrounds. Every youngster should have the opportunity to achieve in life, in my opinion. I started learning to love and care for disadvantaged kids more after that day.  I have a large heart and I send it to them all the time because I care and love them so much.",7,love,Positive emotions,1
"Poor children have always held a particular place in my heart. In my opinion, every young person should have the chance to succeed in life. After that day, I began to develop a deeper love and compassion for underprivileged children.  My heart is big, and I constantly send it to them because I care and love them so much.",7,love,Positive emotions,1
"I'll take part in a competition and am confident I'll take home the top honors. Such positivity gives me hope, buoyancy, and confidence.",8,optimism,Positive emotions,1
"I will participate in a competition; I feel very optimistic that I will win the first prize. Such optimism helps me gain hopefulness, buoyancy and confidence",8,optimism,Positive emotions,1
"I have always been an optimistic person. I believe that there is always a silver lining in every situation. From that day on, I learned to look at the bright side of things and to stay positive no matter what.",8,optimism,Positive emotions,1
I've always had a positive outlook on life. I firmly think that every circumstance has a bright side. I gained the ability to see the silver lining in any situation and to maintain my optimistic outlook as a result of that day.,8,optimism,Positive emotions,1
I've always been optimistic about life. I genuinely believe that there is good in every situation. That day gave me the capacity to keep my positive mindset and the ability to see the silver lining in any circumstance.,8,optimism,Positive emotions,1
"I'll participate in a competition and am sure I'll win first place. Such enthusiasm instills optimism, buoyancy, and confidence in me",8,optimism,Positive emotions,1
